{
  "schema_version": "lathe.wonder_report.v1",
  "scene_id": "stdlib_component_showcase",
  "scene_version": 1,
  "mode": "preview",
  "status": "golden_fixture_ready",
  "summary": "stdlib_component_showcase validates as a deterministic Wonder golden fixture with proxy-only preview build/render/export evidence.",
  "counts": {
    "objects": 49,
    "asset_tasks": 49,
    "assembly_tasks": 49,
    "render_tasks": 2,
    "export_tasks": 1,
    "materials": 5,
    "lights": 1,
    "cameras": 1
  },
  "optional_lanes": {
    "blender": {
      "status": "skipped_optional",
      "blocking": false,
      "reason": "Blender-backed rendering is outside Wave 5 example-golden core mode."
    },
    "roblox": {
      "status": "skipped_optional",
      "blocking": false,
      "reason": "Roblox Studio execution is outside Wave 5 example-golden core mode."
    }
  },
  "artifacts": {
    "scene_plan": "expected/scene_plan.example.json",
    "scene_manifest": "expected/scene_manifest.example.json",
    "preview_evidence": "expected/preview_evidence.example.json"
  },
  "diagnostics": [
    {
      "code": "SP2001",
      "name": "object_count_exceeds_mode_budget",
      "severity": "warning",
      "contract": "scene_plan",
      "phase": "scene_planning",
      "path": "/objects",
      "message": "Scene has 49 objects, above the preview mode budget of 32 objects.",
      "details": {
        "object_count": 49,
        "max_objects": 32,
        "mode": "preview"
      }
    },
    {
      "code": "SP2002",
      "name": "complexity_exceeds_mode_budget",
      "severity": "warning",
      "contract": "scene_plan",
      "phase": "scene_planning",
      "path": "/",
      "message": "Scene rough complexity score 779 is above the preview mode budget of 320.",
      "details": {
        "estimated_complexity": 779,
        "max_complexity": 320,
        "mode": "preview"
      }
    }
  ]
}
